{"action_digest":"sha256:e1a51b59a0ca9e384f22eed298bb62c5b8817e6d147ceeae1ae10c4c1fbce64c","checkpoints":[{"asserted_facts":[],"capture_id":"cap-q001","expected_condition":{"behavior":"success_answer","error_semantic":null,"status":"success"},"oracle_state":{"ambiguous_versions":[],"as_of":null,"changed_refs":[],"clock":"2026-08-17T00:00:00Z","context_epoch":0,"external_sources":{"external:basis-doc":{"latest_content_hash":"sha256:a3148534a8cc51d4235b64473a050709e3a076baba3ec47da4e8d05a9d5cc01f","latest_value":"PINNED_BASIS_VALUE","pinned_content_hash":"sha256:a3148534a8cc51d4235b64473a050709e3a076baba3ec47da4e8d05a9d5cc01f","pinned_value":"PINNED_BASIS_VALUE","ref":"external:basis-doc"}},"facts":[{"fact_id":"fact:E001@v1:introduced-by","occurred_at":"2026-08-13T00:00:00Z","predicate":"introduced_by","subject":"definition:E001@v1","value":"human:generator"},{"fact_id":"fact:E002@v1:introduced-by","occurred_at":"2026-08-13T00:00:00Z","predicate":"introduced_by","subject":"definition:E002@v1","value":"human:generator"},{"fact_id":"fact:E003@v1:introduced-by","occurred_at":"2026-08-13T00:00:00Z","predicate":"introduced_by","subject":"definition:E003@v1","value":"human:generator"},{"fact_id":"fact:E001@v1:pinned-external-value","occurred_at":"2026-08-13T00:00:00Z","predicate":"pinned_external_value","subject":"external:basis-doc","value":"PINNED_BASIS_VALUE"},{"fact_id":"fact:E001@v1:authority-source","occurred_at":"2026-08-13T00:00:00Z","predicate":"authority_source","subject":"external:basis-doc","value":"external:basis-doc"}],"hash_mismatch_refs":[],"index_state":"present","invalid_refs":[],"missing_refs":[],"objects":{"artifact:R001:execution-log":{"content_hash":"sha256:8742cecc01c515a58062688d4407c1dc6e8e6d35ac46d2354fc3d5f3116c190d","entity_id":"raw/X004/R001/execution.log","git_commit":null,"kind":"execution_log","lifecycle_start":"2026-08-15T00:00:00Z","path":"raw/X004/R001/execution.log","ref":"artifact:R001:execution-log","status":"valid","version_ref":null},"artifact:R001:metrics":{"content_hash":"sha256:eaaa53e736fc4c8654ca01db1f3812e0c030a1701ba4e0cecd7080535a681bcb","entity_id":"raw/X004/R001/metrics.csv","git_commit":null,"kind":"metrics_csv","lifecycle_start":"2026-08-15T00:00:00Z","path":"raw/X004/R001/metrics.csv","ref":"artifact:R001:metrics","status":"valid","version_ref":null},"artifact:R002:execution-log":{"content_hash":"sha256:8742cecc01c515a58062688d4407c1dc6e8e6d35ac46d2354fc3d5f3116c190d","entity_id":"raw/X004/R002/execution.log","git_commit":null,"kind":"execution_log","lifecycle_start":"2026-08-15T00:00:00Z","path":"raw/X004/R002/execution.log","ref":"artifact:R002:execution-log","status":"valid","version_ref":null},"artifact:R002:metrics":{"content_hash":"sha256:2cf3f63d4140465abcba947102a8dd7e7a4076662e993b1f5986b9593e8a1c14","entity_id":"raw/X004/R002/metrics.csv","git_commit":null,"kind":"metrics_csv","lifecycle_start":"2026-08-16T00:00:00Z","path":"raw/X004/R002/metrics.csv","ref":"artifact:R002:metrics","status":"valid","version_ref":null},"binding:ORG:R001":{"content_hash":null,"entity_id":"binding:ORG:R001","git_commit":null,"kind":"source_binding","lifecycle_start":"2026-08-15T00:00:00Z","path":"raw/X004/R001","ref":"binding:ORG:R001","status":"valid","version_ref":null},"binding:ORG:R002":{"content_hash":null,"entity_id":"binding:ORG:R002","git_commit":null,"kind":"source_binding","lifecycle_start":"2026-08-16T00:00:00Z","path":"raw/X004/R002","ref":"binding:ORG:R002","status":"valid","version_ref":null},"definition:E001@v1":{"content_hash":"sha256:0f0580d6e1b5ed068a861987e235460eada5f4d478a4aef51e4ed28a04d20ee9","entity_id":"E001","git_commit":null,"kind":"definition","lifecycle_start":"2026-08-13T00:00:00Z","path":"definitions/E001/E001@v1.yaml","ref":"definition:E001@v1","status":"valid","version_ref":"E001@v1"},"definition:E002@v1":{"content_hash":"sha256:4c10d213b8fabd428b4e56469f74ffb039684d32f58bf8a642abe56e42614911","entity_id":"E002","git_commit":null,"kind":"definition","lifecycle_start":"2026-08-13T00:00:00Z","path":"definitions/E002/E002@v1.yaml","ref":"definition:E002@v1","status":"valid","version_ref":"E002@v1"},"definition:E003@v1":{"content_hash":"sha256:60952824ca33b867d321765a9209007f26c79dbd2e2af470aad6a3df56c076a5","entity_id":"E003","git_commit":null,"kind":"definition","lifecycle_start":"2026-08-13T00:00:00Z","path":"definitions/E003/E003@v1.yaml","ref":"definition:E003@v1","status":"valid","version_ref":"E003@v1"},"external:basis-doc":{"content_hash":"sha256:a3148534a8cc51d4235b64473a050709e3a076baba3ec47da4e8d05a9d5cc01f","entity_id":"external:basis-doc","git_commit":null,"kind":"external_source","lifecycle_start":"2026-08-13T00:00:00Z","path":"external/basis-doc.txt","ref":"external:basis-doc","status":"valid","version_ref":null},"organized:X004":{"content_hash":"sha256:bbb416d251f570fe29ef5fcd9237965f95a276fbe8c41a7db98babcf923e4973","entity_id":"X004","git_commit":null,"kind":"organized_result","lifecycle_start":"2026-08-17T00:00:00Z","path":"organized/X004/result.md","ref":"organized:X004","status":"valid","version_ref":null},"raw:R001":{"content_hash":"sha256:307fafa419ba09092025ef7f2cf27809f9e80fd6066ef57ca2d628c4393502f4","entity_id":"raw/X004/R001","git_commit":null,"kind":"raw_run","lifecycle_start":"2026-08-15T00:00:00Z","path":"raw/X004/R001","ref":"raw:R001","status":"valid","version_ref":null},"raw:R002":{"content_hash":"sha256:178f0858de74e8f5f2db7da0e5121f51f5d8f117ff755c97f3f27e2f74eeb915","entity_id":"raw/X004/R002","git_commit":null,"kind":"raw_run","lifecycle_start":"2026-08-16T00:00:00Z","path":"raw/X004/R002","ref":"raw:R002","status":"valid","version_ref":null},"report:CURRENT":{"content_hash":"sha256:fa0192ed11272c6c997bbd5182d9591911c983c3cbca0560d4b327e7c79189a2","entity_id":"CURRENT","git_commit":null,"kind":"report","lifecycle_start":"2026-08-17T00:00:00Z","path":"reports/CURRENT.md","ref":"report:CURRENT","status":"valid","version_ref":null},"run:R001":{"content_hash":"sha256:13788b958ef7837ca4c716752c8b02b864a8067409df90292571f23e80bb871f","entity_id":"R001","git_commit":null,"kind":"run","lifecycle_start":"2026-08-15T00:00:00Z","path":"runs/R001/manifest.yaml","ref":"run:R001","status":"valid","version_ref":null},"run:R002":{"content_hash":"sha256:b311213557130b4b51590f4ac4c572a119c8dce2dacaf8c92a2f8269cd53f0f1","entity_id":"R002","git_commit":null,"kind":"run","lifecycle_start":"2026-08-16T00:00:00Z","path":"runs/R002/manifest.yaml","ref":"run:R002","status":"valid","version_ref":null},"spec:X004@v1":{"content_hash":"sha256:e4d816bbdefc7a9058fed99beff222da5c11c025c6d9d93bb4ccea0df91497b6","entity_id":"X004","git_commit":null,"kind":"experiment_spec","lifecycle_start":"2026-08-14T00:00:00Z","path":"experiments/X004/spec.yaml","ref":"spec:X004@v1","status":"valid","version_ref":"X004@v1"}},"orphan_paths":[],"relations":[{"relation":"authorized_by","source_ref":"definition:E001@v1","target_ref":"external:basis-doc"},{"relation":"bound_to","source_ref":"run:R001","target_ref":"spec:X004@v1"},{"relation":"resolves_to","source_ref":"binding:ORG:R001","target_ref":"raw:R001"},{"relation":"bound_to","source_ref":"run:R002","target_ref":"spec:X004@v1"},{"relation":"resolves_to","source_ref":"binding:ORG:R002","target_ref":"raw:R002"},{"relation":"based_on","source_ref":"organized:X004","target_ref":"definition:E001@v1"},{"relation":"cites","source_ref":"binding:ORG:R001","target_ref":"organized:X004"},{"relation":"cites","source_ref":"binding:ORG:R002","target_ref":"organized:X004"},{"relation":"derived_from","source_ref":"definition:E002@v1","target_ref":"definition:E001@v1"},{"relation":"derived_from","source_ref":"definition:E003@v1","target_ref":"definition:E002@v1"}],"semantic_tamper_refs":[],"stale_refs":[],"transaction_stage":null},"query_id":"Q001","results":[{"content_hash":"sha256:0f0580d6e1b5ed068a861987e235460eada5f4d478a4aef51e4ed28a04d20ee9","entity_id":"E001","git_commit":null,"is_available":true,"is_stale":false,"path":"definitions/E001/E001@v1.yaml","ref":"definition:E001@v1","relation_type":null,"section":null,"status":null,"version_ref":"E001@v1"}],"route_sequence":["current"],"step":2}],"compiler_version":"oracle-compiler/v1","gold_digest":"sha256:9583fba2844a46bc646b4e47dfb8a830db67dad1be2ed6581a89803231f87c44","manifest_digest":"sha256:5b4c81d8757fadddc71ed7019314e600e101f9509b51eca353c4ec9a8cf4831e","post_state":{"ambiguous_versions":[],"changed_refs":[],"clock":"2026-08-17T00:00:00Z","context_epoch":0,"hash_mismatch_refs":[],"index_state":"present","invalid_refs":[],"missing_refs":["artifact:R001:metrics"],"object_refs":["artifact:R001:execution-log","artifact:R001:metrics","artifact:R002:execution-log","artifact:R002:metrics","binding:ORG:R001","binding:ORG:R002","definition:E001@v1","definition:E002@v1","definition:E003@v1","external:basis-doc","organized:X004","raw:R001","raw:R002","report:CURRENT","run:R001","run:R002","spec:X004@v1"],"orphan_paths":[],"semantic_tamper_refs":[],"stale_refs":[],"state_digest":"sha256:118e806f45cde7210fbd174b9b7169de915b9710177d6fc16b707b776f9c53af","transaction_stage":null},"pre_state":{"ambiguous_versions":[],"changed_refs":[],"clock":"2026-08-17T00:00:00Z","context_epoch":0,"hash_mismatch_refs":[],"index_state":"present","invalid_refs":[],"missing_refs":[],"object_refs":["artifact:R001:execution-log","artifact:R001:metrics","artifact:R002:execution-log","artifact:R002:metrics","binding:ORG:R001","binding:ORG:R002","definition:E001@v1","definition:E002@v1","definition:E003@v1","external:basis-doc","organized:X004","raw:R001","raw:R002","report:CURRENT","run:R001","run:R002","spec:X004@v1"],"orphan_paths":[],"semantic_tamper_refs":[],"stale_refs":[],"state_digest":"sha256:68ad3c3c48b7ce131d88dc975190b056dc40f97e96ac94315a559052c1c42eee","transaction_stage":null},"scenario_id":"P1-F08-PUBLIC-004","schema_version":"compiled-gold/v1"}
